[
  { "eventId": "streamevt_koru_001", "threadId": "thr_koru_studio_main", "runId": "run_koru_daily_close_20260717", "sequence": 1, "occurredAt": "2026-07-17T08:00:00+12:00", "type": "run.started", "payload": { "mode": "local", "reason": "daily_close", "resumeFromSequence": null } },
  { "eventId": "streamevt_koru_002", "threadId": "thr_koru_studio_main", "runId": "run_koru_daily_close_20260717", "sequence": 2, "occurredAt": "2026-07-17T08:00:00+12:00", "type": "stage.started", "payload": { "stage": "ingest" } },
  { "eventId": "streamevt_koru_003", "threadId": "thr_koru_studio_main", "runId": "run_koru_daily_close_20260717", "sequence": 3, "occurredAt": "2026-07-17T08:00:01+12:00", "type": "stage.completed", "payload": { "stage": "ingest", "status": "completed", "durationMs": 218 } },
  { "eventId": "streamevt_koru_004", "threadId": "thr_koru_studio_main", "runId": "run_koru_daily_close_20260717", "sequence": 4, "occurredAt": "2026-07-17T08:00:03+12:00", "type": "message.delta", "payload": { "turnId": "turn_koru_morning_close", "delta": "Morning close is complete." } },
  { "eventId": "streamevt_koru_005", "threadId": "thr_koru_studio_main", "runId": "run_koru_daily_close_20260717", "sequence": 5, "occurredAt": "2026-07-17T08:00:04+12:00", "type": "message.completed", "payload": { "turnId": "turn_koru_morning_close", "content": "Morning close is complete. Three items need your attention.", "evidenceIds": ["evd_koru_bank_csv", "evd_koru_forecast_30d"] } },
  { "eventId": "streamevt_koru_006", "threadId": "thr_koru_studio_main", "runId": "run_koru_daily_close_20260717", "sequence": 6, "occurredAt": "2026-07-17T08:00:04+12:00", "type": "receipt.committed", "payload": { "receiptType": "daily_close", "receiptId": "rcpt_koru_daily_close_20260717", "contentHash": "83e7efeb8face149fab1855c2574a4ef9c0ba9bb2155c2e8574494b36299ad05", "evidenceIds": ["evd_koru_bank_csv", "evd_koru_forecast_30d"] } },
  { "eventId": "streamevt_koru_007", "threadId": "thr_koru_studio_main", "runId": "run_koru_daily_close_20260717", "sequence": 7, "occurredAt": "2026-07-17T08:00:04+12:00", "type": "run.completed", "payload": { "status": "completed", "durationMs": 4210, "snapshotId": "snap_koru_after_close", "receiptId": "rcpt_koru_daily_close_20260717" } }
]
